{
  "schema_version": 1,
  "idea": "ITE: an interview-first environment to think and specify before building with Claude Code.",
  "language": "pt",
  "created_at": "2026-10-15T12:00:00Z",
  "updated_at": "2026-10-15T12:00:00Z",
  "approved_at": "2026-10-15T12:00:00Z",
  "mode": "manual",
  "question_budget": null,
  "areas": [
    {
      "id": "goal",
      "state": "clear",
      "summary": "Turn a one-line idea into a complete, coherent, tested spec folder that Claude Code builds from; success = the A/B validation clears the D-021 pass bar (R-021).",
      "decision_ids": [
        "D-021"
      ],
      "test_ids": [
        "T-024",
        "T-035"
      ],
      "reason": null
    },
    {
      "id": "users",
      "state": "clear",
      "summary": "Primary: non-engineer builders; secondary: early-career developers (D-003).",
      "decision_ids": [
        "D-003"
      ],
      "test_ids": [
        "T-003"
      ],
      "reason": null
    },
    {
      "id": "scope",
      "state": "clear",
      "summary": "v0.1 = plugin with 4 commands and a quick mode (R-024); v0.2 = Windows-first Tauri app; export, templates, team mode are later (SPEC section 4).",
      "decision_ids": [
        "D-002",
        "D-004"
      ],
      "test_ids": [
        "T-009"
      ],
      "reason": null
    },
    {
      "id": "inputs",
      "state": "clear",
      "summary": "Idea text and user answers only (SPEC section 6).",
      "decision_ids": [],
      "test_ids": [
        "T-002"
      ],
      "reason": null
    },
    {
      "id": "outputs",
      "state": "clear",
      "summary": "Fixed English spec folder with INDEX, SPEC, DECISIONS, PLAN, CLAUDE, prompts, schemas, tests (rule 02).",
      "decision_ids": [
        "D-005"
      ],
      "test_ids": [
        "T-009",
        "T-014"
      ],
      "reason": null
    },
    {
      "id": "integrations",
      "state": "clear",
      "summary": "User's own Claude Code; Node.js 18+ for scripts (assumed).",
      "decision_ids": [
        "D-014",
        "D-016"
      ],
      "test_ids": [
        "T-001",
        "T-025"
      ],
      "reason": null
    },
    {
      "id": "security",
      "state": "clear",
      "summary": "No network, no credentials, project-folder scope only (rule 08).",
      "decision_ids": [],
      "test_ids": [
        "T-021",
        "T-031"
      ],
      "reason": null
    },
    {
      "id": "stack",
      "state": "clear",
      "summary": "Plugin: Markdown commands and skill + zero-dependency Node scripts. App: Tauri 2, React, TypeScript, xterm.js, CodeMirror 6.",
      "decision_ids": [
        "D-013",
        "D-019"
      ],
      "test_ids": [
        "T-030"
      ],
      "reason": null
    },
    {
      "id": "llm",
      "state": "clear",
      "summary": "The interview and compile prompts P-001, P-002, P-003 run in the user's Claude Code.",
      "decision_ids": [
        "D-020"
      ],
      "test_ids": [
        "T-003"
      ],
      "reason": null
    },
    {
      "id": "errors",
      "state": "clear",
      "summary": "Checker error codes in rule 04; command errors in specs/commands.md; interview edge cases in rule 01 section 1.5.",
      "decision_ids": [
        "D-015"
      ],
      "test_ids": [
        "T-012",
        "T-015",
        "T-016"
      ],
      "reason": null
    },
    {
      "id": "acceptance",
      "state": "clear",
      "summary": "41 tests in tests/acceptance.md and tests/cases.json.",
      "decision_ids": [],
      "test_ids": [
        "T-029"
      ],
      "reason": null
    },
    {
      "id": "done",
      "state": "clear",
      "summary": "CLAUDE.md definition of done for Phase 1; T-030 to T-034 for Phase 2.",
      "decision_ids": [],
      "test_ids": [
        "T-029"
      ],
      "reason": null
    }
  ],
  "history": [],
  "stop_reason": "complete"
}